{
  "id": "skill-refactor-safely-controller-extraction",
  "target_type": "skill",
  "target_name": "refactor-code",
  "context_mode": "skill_bundle_xml",
  "requires_companion_resources": true,
  "tessl_export": {
    "supported": false,
    "reason": "Requires XML bundle context with refactoring companion resources; Tessl currently consumes only SKILL.md."
  }
}
