{
  "id": "skill-rails-migration-safety",
  "target_type": "skill",
  "target_name": "review-migration",
  "context_mode": "skill_bundle_xml",
  "requires_companion_resources": true,
  "tessl_export": {
    "supported": false,
    "reason": "Requires XML bundle context with migration safety companion resources; Tessl currently consumes only SKILL.md."
  }
}
