{
  "id": "skill-api-rest-collection",
  "target_type": "skill",
  "target_name": "generate-api-collection",
  "context_mode": "skill_bundle_xml",
  "requires_companion_resources": true,
  "tessl_export": {
    "supported": false,
    "reason": "Requires XML bundle context and source fixtures; Tessl currently consumes only SKILL.md."
  }
}
