{
  "id": "skill-ddd-rails-modeling",
  "target_type": "skill",
  "target_name": "model-domain",
  "context_mode": "skill_bundle_xml",
  "requires_companion_resources": true,
  "tessl_export": {
    "supported": false,
    "reason": "Requires XML bundle context with DDD companion resources; Tessl currently consumes only SKILL.md."
  }
}
