{
  "id": "time-dependent-specs-and-example-naming",
  "target_type": "skill",
  "target_name": "write-tests",
  "context_mode": "skill_bundle_xml",
  "requires_companion_resources": true,
  "tessl_export": {
    "supported": false,
    "reason": "Requires XML bundle context with testing companion resources; Tessl currently consumes only SKILL.md."
  }
}
