{
  "id": "workflow-rails-review-flow",
  "target_type": "workflow",
  "target_name": "review-workflow",
  "context_mode": "skill_bundle_xml",
  "requires_companion_resources": true,
  "tessl_export": {
    "supported": false,
    "reason": "Requires workflow context as an XML bundle with companion resources; Tessl currently consumes only SKILL.md."
  }
}
