{
  "id": "service-spec-structure-and-mocking-conventions",
  "target_type": "skill",
  "target_name": "test-service",
  "context_mode": "skill_bundle_xml",
  "requires_companion_resources": true,
  "tessl_export": {
    "supported": false,
    "reason": "Requires XML bundle context with RSpec companion resources; Tessl currently consumes only SKILL.md."
  }
}
