{
  "id": "skill-rails-engine-author",
  "target_type": "skill",
  "target_name": "create-engine",
  "context_mode": "skill_bundle_xml",
  "requires_companion_resources": true,
  "tessl_export": {
    "supported": false,
    "reason": "Requires XML bundle context with Rails engine companion resources; Tessl currently consumes only SKILL.md."
  }
}
