{
  "id": "skill-rails-bug-triage",
  "target_type": "skill",
  "target_name": "triage-bug",
  "context_mode": "skill_bundle_xml",
  "requires_companion_resources": true,
  "tessl_export": {
    "supported": false,
    "reason": "Requires XML bundle context with bug triage companion resources; Tessl currently consumes only SKILL.md."
  }
}
