{
  "id": "skill-ruby-service-objects",
  "target_type": "skill",
  "target_name": "create-service-object",
  "context_mode": "skill_bundle_xml",
  "requires_companion_resources": true,
  "tessl_export": {
    "supported": false,
    "reason": "Requires XML bundle context with companion resources; Tessl currently consumes only SKILL.md."
  }
}
